{
  "schema": "ssw.intent-envelope.v1",
  "intent_id": "66666666-6666-4666-8666-666666666666",
  "correlation_id": "77777777-7777-4777-8777-777777777777",
  "created_at": "2026-09-19T16:00:00Z",
  "expires_at": "2026-09-19T16:05:00Z",
  "holder_did": "did:soul:holder-alice",
  "sera_agent_did": "did:soul:agent:sera-alice",
  "sera_runtime_id": "sera-runtime:phone-001",
  "device_id": "device:phone-001",
  "source": {
    "modality": "voice",
    "channel": "wallet",
    "raw_input_ref": "utterance:payment-001"
  },
  "interpretation": {
    "intent_type": "payment.send",
    "confidence": 0.98,
    "ambiguity": false,
    "ambiguity_reasons": []
  }
}
